구분,시나리오 넘버,대사 넘버,배경,캐릭터 한글,캐릭터 영문,캐릭터 번자,표정,대사 한글,대사 영문,대사 번자,연출 종류,사운드,INDEX,CODE
,84,1,증명의탑,아스타로트,Astarot,亞斯她錄,화남,난 어둠의 주술사 아스타로트! 너 정도는 아니겠지만 나 역시 카데스의 힘을 받았다! 거기에 이곳 아르하의 힘을 더하면 너 정도는...!,"I am Astaroth, dark sorcerer! I may not be as good as you, but I've also got Kades's power! If I add the power here of Archa, you will be ...!",我是黑暗巫術師亞斯她錄！雖然不如你，但我同樣也受到了卡德斯的力量！再加上這裡阿爾哈的力量，像你這樣的存在...！,,,,
,84,2,증명의탑,블리자드,Blizzard,暴風雪,,안됩니다! 카데스의 힘과 아르하의 기운은 함께 사용할 수 없는 힘입니다!,No way! Power of Kades and Archa are mutually exclusive!,不行！卡德斯的力量與阿爾哈的氣息是無法一同使用的力量！,,,,
,84,3,증명의탑,아스타로트,Astarot,亞斯她錄,화남,시끄럽다! 내가 하겠다는 일에 일일이 토달지 마!,Silence! Do not disturb me!,閉嘴！不要對我想做的事指手劃腳！,,,,
,84,4,증명의탑,이그나,Igna,伊格納,,안됩니다! 그 정도 힘으로는 엔더 드래곤을 쓰러트릴 수 없어요! 목숨만 잃게 될게 뻔합니다!,No way! You can't beat Ender Dragon with that much power! You will lose your life!,不行！以這樣的力量根本無法擊敗終焰龍！只會白白喪命！,,,,
,84,5,증명의탑,아스타로트,Astarot,亞斯她錄,보통,내 마지막 선택 정도는 그냥 내버려둬라. 내가 바라는 일이다.,Leave my last choice alone. It's what I want.,讓我最後的選擇自己決定吧。這是我所渴望的事。,,,,
,84,6,증명의탑,주인공,Player,Player,,아스타로트의 발 밑에 검붉은 마법진이 펼쳐졌다. 그리고 아스타로트의 손에서 밝은 빛이 흩뿌려지며 마법진 위에 떨어졌다.,Dark red Magic Circle appeared under her feet. And a bright light fell from Astaroth's hand onto the Magic Circle.,在亞斯她錄的腳下，展開了血紅色的魔法陣。隨著亞斯她錄的手中散發出明亮的光芒，這些光點落在魔法陣上。,,,,
,84,7,증명의탑,주인공,Player,Player,,그 순간 아스타로트의 얼굴이 고통으로 일그러졌다. 꽉 깨문 입술이 터져 피가 흘러나오는게 보였다.,"At that moment, Astaroth's face was distorted with pain. I could see blood flow out of her lips, which she bit tightly.",就在那一刻，亞斯她錄的臉龐因痛苦而扭曲。緊咬的嘴唇裂開，血液開始流了出來。,,,,
,84,8,증명의탑,드래곤 슬레이어,Dragon Slayer,屠龍者,변신,저거 진짜 저러다 죽는다. 쉴라 여신은 아직이냐?,She killing herself. Where is Shilla?,那樣下去真的會死的。希拉女神還沒來嗎？,,,,
,84,9,증명의탑,솔라,Solar,太陽龍,,"안돼! 제발, 여신님 빨리 와주세요! 시렐라 님이 죽습니다!","No! Please, my goddess, come quickly! Sirella is going to die!",不行！拜託，女神快來！西瑞拉大人快死了！,,,,
,84,10,증명의탑,엔더 드래곤,Ender dragon,終焰龍,,그만둬라. 그 힘을 사용하면 넌 순환에서 벗어나게 된다. 두 번 다시 여기 있는 자들과 만나지 못하게 된다.,"Stop it. If you use that power, you will get out of circulation. You will never see anyone here again.",停止吧。使用那股力量，你將脫離循環，永遠無法再見到這裡的任何人。,,,,
,84,11,증명의탑,렉스톤,Rexton,雷克斯頓,변신,"그래, 쟤까지 말리는데 뭐하러 하는거야!","Yeah, you don't have to go that far.",對啊，連她都在勸阻，幹嘛還要繼續這樣做！,,,,
,84,12,증명의탑,엔더 드래곤,Ender dragon,終焰龍,,다시 한번 경고한다. 날 막기엔 부족한 힘이다. 그리고 넌 영혼까지 조각나 두 번 다시 이 땅에 태어나지 못한다.,I warn you once again. It's not enough to stop me. And you will not born again because your soul is broken.,我再警告你一次。要阻止我，你的力量還不夠。而且，你的靈魂將會碎裂，永遠無法在這片大地上重生。,,,,
,84,13,증명의탑,아스타로트,Astarot,亞斯她錄,웃음,큭큭큭. 왜지? 왜 이렇게 날 말리려고 드는거냐 엔더 드래곤?,"Why? Why are you trying to stop me, Ender Dragon?",呵呵呵。為什麼呢？為什麼你會這麼努力想要阻止我，終焰龍？,,,,
,84,14,증명의탑,주인공,Player,Player,,아스타로트는 고통스러운 와중에 웃음을 보이며 엔더 드래곤에게 물었다. 확실히 이상했다. 말릴 이유는 전혀 없었다.,Astaroth smiled and asked Ender Dragon in pain. It was certainly strange. There was no reason for Ender Dragon to stop her.,亞斯她錄在痛苦中露出笑容，問著終焰龍。確實，這樣的行為很奇怪，根本沒有阻止的理由。,,,,
,84,15,증명의탑,엔더 드래곤,Ender dragon,終焰龍,,무의미하다. 넌 내가 의도하는 '파멸'과는 다른 '파멸'로 치닫고 있다. 무의미한 파멸은 내 의도된 파멸과는 다르다.,It's meaningless. You are heading for another 'doom' from what I mean. Inane destruction is not what I intended.,毫無意義。你正在走向的「滅亡」與我所意圖的「滅亡」是不同的。無意義的滅亡，與我所計劃的滅亡完全不同。,,,,
,84,16,증명의탑,아스타로트,Astarot,亞斯她錄,보통,이 파멸 저 파멸 나눠서 구분하는 거냐? 멍청한 소리구나. 우리에겐 끝은 그냥 끝일 뿐이다. 그리고 그 끝을 선택하는건 나 자신이다.,How could you distinguishing the doom? That's silly. The end is just the end for us. And it is myself to choose the end.,把這個滅亡那個滅亡分開來區分嗎？真是愚蠢的話。我們的結局，對我們來說不過就是結局而已。而選擇那個結局的，只有我自己。,,,,
,84,17,증명의탑,주인공,Player,Player,,아스타로트의 대답에 엔더 드래곤이 흠칫 놀란게 보였다.,Ender Dragon looked surprised at Astaroth's answer.,亞斯她錄的回答讓終焰龍微微一驚。,,,,
,84,18,증명의탑,아스타로트,Astarot,亞斯她錄,보통,아직 언니가 살아있다면 됐다. 그러면 아르하는 다시 살아나겠지. 너와 나만 없어지면 아르하는 깨끗해진다.,"If my sister was still alive, it will be fine. Then Archa will revive. It will be clean if you and I are gone.",只要姐姐還活著就好了。那麼，阿爾哈應該會重生吧。只要你和我消失，阿爾哈就能被清除乾淨。,,,,
,84,19,증명의탑,다크나이트,Dark Knight,黑騎士,,시렐라님 안됩니다!,"Sirella, no!",西瑞拉大人，不行！,,,,
,84,20,증명의탑,아스타로트,Astarot,亞斯她錄,보통,작별이다 수호룡들아. 아르하를 부탁한다.,"Goodbye, guardians. Do your best for Archa.",告別了，守護龍們。請好好照顧阿爾哈。,,,,
,84,21,증명의탑,주인공,Player,Player,,그리고 마법진을 중심으로 강렬한 빛이 터져나왔다. 난 그만 눈을 감고 말았다.,Then a strong light exploded around the Magic Circle. I just closed my eyes.,隨著魔法陣的中心爆發出強烈的光芒，我不禁閉上了眼睛。,,,,
,,,,,,,,밝은 빛을 확인하자(증명의 탑에 퀘스트 표시),Check the light.,確認亮光（證明之塔顯示了任務標記）,,,,
,85,1,증명의탑,주인공,Player,Player,,밝은 빛이 잦아들고 난 뒤 그곳에는...... 아스타로트가 남았다.,"After the bright light died down, Astaroth was still there.",當亮光漸漸消退後，那裡......只剩下了亞斯她錄。,,,,
,85,2,증명의탑,아스타로트,Astarot,亞斯她錄,보통,......,(silent),......,,,,
,85,3,증명의탑,주인공,Player,Player,,"아스타로트가 다시 한번 지팡이를 들어올려 마법진의 중심을 내리쳤다. 한 번, 두 번...... 결국 쾅쾅 두들기기 시작했다.","Astaroth struck the center of the Magic Circle with her staff again. Once, twice... at last she began to pound.",亞斯她錄再次舉起了法杖，猛擊魔法陣的中心。一次、兩次......最終開始猛烈地敲擊起來。,,,,
,85,4,증명의탑,아스타로트,Astarot,亞斯她錄,화남,......익!,What?!,……啊！,,,,
,85,5,증명의탑,주인공,Player,Player,,그 순간 포폰이 용맹하게 달려들어 아스타로트를 덮쳤다! 둘은 데굴데굴 굴러서 마법진 위를 벗어났다.,"At that moment, Popon pounced on Astaroth! Both rolled out of the Magic Circle.",就在那一刻，波鵬勇猛地衝了過來，將亞斯她錄撞倒！他們滾滾滾地滾出了魔法陣。,,,,
,85,6,증명의탑,포폰,Popon,波彭,,"아야! 잘, 잘못했어요 시렐라 님! 때리지 마세요!","Ouch! Well, I'm sorry, Sirella! Don't hit me!",哎呀！我、我錯了，西瑞拉大人！請不要打我！,,,,
,85,7,증명의탑,솔라,Solar,太陽龍,,잘했어 포폰!,Good job!,做得好，波彭！,,,,
,85,8,증명의탑,주인공,Player,Player,,얼굴이 벌겋게 달아오른 게 화가 난 건지 부끄러운건진 모르겠지만 아스타로트가 포폰에게 온갖 욕설을 쏟아내기 시작했다.,"Her red face may be angry or embarrassing, but she has begun to pour out all kinds of abuse at Popon.",阿斯塔羅特的臉紅得像是燒著了一樣，不知道是生氣還是害羞，但她開始對波封甩出了各種罵聲。,,,,
,85,9,증명의탑,쉴라 여신,Sirella,西瑞拉,,"다행이군요. 시간에 안 늦은 것 같습니다. 그리고 시렐라, 그런 나쁜 말은 하면 안돼.","I'm so lucky I'm not late. And Sirella, watch your language.",真是太好了，看來時間還不算太晚。而且，西瑞拉，這種壞話可不能說。,,,,
,85,10,증명의탑,아스타로트,Astarot,亞斯她錄,화남,"어, 언니?!","Uh, sister?!",哦，姐姐？！,,,,
,85,11,증명의탑,주인공,Player,Player,,"여신님이 나타났다! 어떠한 예고도 없이, 아스타로트의 등 뒤에 밝은 빛무리로 갑자기 모습을 드러내셨다.","The goddess appeared! Without any notice, she suddenly appeared behind Astaroth's back in bright light.",女神出現了！毫無預告地，突然在亞斯她錄的背後，光芒一閃，她的身影便顯現出來。,,,,
,85,12,증명의탑,다크나이트,Dark Knight,黑騎士,,여신님......,My goddess.,女神大人......,,,,
,85,13,증명의탑,쉴라 여신,Sirella,西瑞拉,,오랜만이군요 다크나이트. 현실감각을 갖춰서 돌아왔습니다.,Long time no see. Dark knight. I'm back with 'Reality',好久不見了，黑騎士。這次我有記得帶我的現實感。,,,,
,85,14,증명의탑,다크나이트,Dark Knight,黑騎士,,어...... 네?,Uh ...... yeah?,哦......甚麼?,,,,
,85,15,증명의탑,주인공,Player,Player,,당황한 다크나이트의 표정에 빛무리가 웃는 듯이 떨렸다. 역시...... 어디선가 듣고 계셨구나.,A group of lights shook at the puzzled look of the Dark knight. So... she has been listening somewhere.,當驚慌失措的黑騎士露出表情時，光芒似乎在微微顫抖，像是在笑。果然......你還是在某個地方聽到了吧。,,,,
,85,16,증명의탑,쉴라 여신,Sirella,西瑞拉,,다들 고생 많으셨습니다. 덕분에 충분히 힘을 모을 수 있었어요. 아르하는 지켜질겁니다.,Thank you for all of this. I was able to recover. Archa will be safe from now on.,大家辛苦了。多虧了你們，我才能夠積聚足夠的力量。阿爾哈將會被保護的。,,,,
,85,17,증명의탑,엔더 드래곤,Ender dragon,終焰龍,,"불가능하다. 파멸은 약속된 것이다. 쉴라, 너 역시 끝에 서있을 뿐이다.","That's impossible. Destruction is a promise. Shilla, you're just standing at the end.",不可能。滅亡是注定的。希拉，你也只不過站在結局的一端。,,,,
,85,18,증명의탑,쉴라 여신,Sirella,西瑞拉,,고작 날개 한 장 주제에 말은 거창하군요. 그리고 그 이름으로 날 부르지 마세요.,You talk big without even knowing your place. And don't call me by that name.,光是片翅膀就敢說這麼大的話。還有，不要再用那個名字來叫我。,,,,
,85,19,증명의탑,주인공,Player,Player,,분위기는 한순간에 변했다. 여신님의 한마디 한마디가 든든하기 그지 없었다. 아스타로트의 표정만 빼면 말이다.,The atmosphere changed in a moment. Every word of the goddess was too reliable. Except for Astaroth's look.,氣氛瞬間改變了。女神大人的每一句話都讓人感到無比堅定。除了亞斯她錄的表情之外。,,,,
,85,20,증명의탑,솔라,Solar,太陽龍,,여신님......,My goddess...,女神大人......,,,,
,85,21,증명의탑,쉴라 여신,Sirella,西瑞拉,,"솔라, 당신에게는 그저 감사할 따름입니다. 다른 수호룡을 이끌고 여기까지 잘 와주셨군요.","Thank you, Solar. You led the other guardian dragons here.",索拉，我只能感謝你。帶領其他守護龍一路順利來到這裡。,,,,
,85,22,증명의탑,솔라,Solar,太陽龍,,"아닙니다. 유타칸 테이머의 도움과, 모든 수호룡의 의지가 있어서 해낼 수 있었습니다.",No. I could do it because of tamer's help and will of every guardian dragons.,不對。是因為尤塔勘屠龍者的幫助，以及所有守護龍的意志，我們才能做到這一點。,,,,
,85,23,증명의탑,쉴라 여신,Sirella,西瑞拉,,모든이라...... 처음부터 '모든'은 아니었겠죠?,"Every... Not ""Every' from the start, right?",所有嗎……該不會從一開始就包含所有吧?,,,,
,85,24,증명의탑,이그나,Igna,伊格納,,아니 저희도 나름의 사정이......,We had our own reasons.,不，我們也有我們的難處……,,,,
,85,25,증명의탑,주인공,Player,Player,,당황한 이그나가 말을 주워담았지만 결국 배신자의 변명일 뿐이었다. 놀랍게도 여신님은 흔쾌히 그 말을 받아들였다.,"Igna took back his words when he was embarrassed, but it was only an excuse for a betrayer. To my surprise, the goddess accepted the words gladly.",雖然慌亂的伊格納試圖收回話語，但最終也只是一個背叛者的辯解。令人驚訝的是，女神卻欣然接受了這番話。,,,,
,85,26,증명의탑,쉴라 여신,Sirella,西瑞拉,,"이해합니다. 여러분 셋은 시렐라의 뜻을 존중했을 뿐이겠죠. 하지만 시렐라, 그때 네 의지는 알고 있었지만 우리로선 받아들일 수 없는 제안이었구나.","I understand. I guess the three of you just respected Sirella's will. But Sirella, at the time, I could understand your will, but it was an offer we couldn't accept.",我能理解。你們三個只是尊重西瑞拉的意思而已。但西瑞拉，那時候我知道你的意圖，但對我們來說，這是我們無法接受的提議。,,,,
,85,27,증명의탑,주인공,Player,Player,,아스타로트는 고개를 숙인 채 아무 말도 없었다.,Astaroth lowered her head and said nothing.,亞斯她錄低著頭，什麼也沒說。,,,,
,85,28,증명의탑,쉴라 여신,Sirella,西瑞拉,,악에 굴복하고 빛을 지우는 일은...... 설령 필요하다 하더라도 용기가 필요한 일이겠지. 네 판단은 존중해. 우린 자매니까.,It takes courage to give up light even if it is necessary. I respect your judgment. Because we're sisters.,屈服於邪惡，抹去光明的事情……即使這是必要的，也需要勇氣吧。我尊重你的判斷。我們是姐妹嘛。,,,,
,85,29,증명의탑,쉴라 여신,Sirella,西瑞拉,,하지만 난 또다시 같은 일이 벌어져도 같은 선택을 할거야. 너 역시 나와 같은 대답을 할 수 있을지는 잘 모르겠구나.,But I will make the same choice if it happens again. I'm not sure you'll be able to give me the same answer.,但即便再次發生同樣的事情，我還是會做出相同的選擇。你是否能和我做出一樣的決定，我倒不太確定了。,,,,
,85,30,증명의탑,주인공,Player,Player,,아스타로트는 여전히 아무 말도 없었다.,Astaroth was still silent.,亞斯她錄依然什麼也沒說。,,,,
,85,31,증명의탑,쉴라 여신,Sirella,西瑞拉,,"자, 엔더 드래곤. 함께 떠나보죠.","All right, Ender Dragon. Let's go together.",來吧，終焰龍。我們一起離開吧。,,,,
,85,32,증명의탑,엔더 드래곤,Ender dragon,終焰龍,,아르하의 파멸이 있기 전까지는 난 어디로도 떠나지 않는다.,I won't leave anywhere until Archa turns to ruin.,在阿爾哈的毀滅之前，我不會離開任何地方。,,,,
,85,33,증명의탑,쉴라 여신,Sirella,西瑞拉,,권유한게 아닙니다. 당신을 이 세계에서 뜯어내주죠.,This is not a suggestion. I'll take you out from Archa.,我不是在勸說。我會把你從這個世界中扯出來。,,,,
,85,34,증명의탑,주인공,Player,Player,,"그 말을 끝으로, 빛이 점점 커지기 시작했다. 온 몸에 따스한 기운이 감도는 것이 아주 편안해졌다.","After that, the light began to grow and make me warm. The warmth of the whole body made me very comfortable.",說完這句話，光芒開始逐漸增強。全身感到一股溫暖的氣息，讓人感到非常舒適。,,,,
,85,35,증명의탑,드래곤 슬레이어,Dragon Slayer,屠龍者,변신,결국은 저 선택인가.,Is it that choice after all?,最終還是那個選擇嗎？,,,,
,85,36,증명의탑,고대신룡,God Dragon,古代神龍,변신,어떻게 할 수 없지 우리로선. 여신의 선택이니 지켜볼수밖에.,"We can't do anything. It's the choice of the goddess, so we'll have to wait and see.",對我們來說無能為力。既然是女神的選擇，就只能旁觀。,,,,
,85,37,증명의탑,렉스톤,Rexton,雷克斯頓,변신,"아, 역시......","Oh, so be it.",啊，果然......,,,,
,85,38,증명의탑,주인공,Player,Player,,응? 무슨 말이지? 드래곤들의 대화가 이해가 가질 않았다. 여신님이 무슨 선택을 한건지 물어보자 충격적인 대답이 들려왔다.,"Huh? What do you mean? I can't understand the conversation between the dragons. When I asked what choice she had made, a shocking answer came.",嗯？那是什麼意思？我無法理解龍族的對話。我問起女神做了什麼選擇，卻聽到了震驚的回答。,,,,
,85,39,증명의탑,솔라,Solar,太陽龍,,"방금 시렐라님이 한 것과...... 똑같다. 다른 점이라면 카데스의 힘 없이, 순수한 아르하의 힘만으로 엔더 드래곤을 추방하는거지.","Just like... what Sirella just did. The other thing is, without the power of Kades, she can expel Ender Dragon with pure power of Archa.",剛才西瑞拉大人所做的……一模一樣。不同之處在於，這次沒有卡德斯的力量，而是單純靠阿爾哈的力量將終焰龍驅逐出去。,,,,
,85,40,증명의탑,포폰,Popon,波彭,,아르하 곳곳에 흔적만 남아있던 '강림의 돌'의 힘을 모두 모아오셨어. 딱 한 번만 쓸 수 있겠지만......,she collected all the power of the advent stone that was left in Archa. It could only be used once...,她將散落在阿爾哈各地的‘降臨之石’的力量都集結起來了。雖然只能使用一次……,,,,
,85,41,증명의탑,제피로스,Zephyros,澤費羅斯,,그걸로 충분하다. 여신님은 엔더 드래곤과 함께 사라지실거야.,That's enough. The goddess will disappear with Ender Dragon.,這樣就足夠了。女神將與終焰龍一同消失。,,,,
,85,42,증명의탑,주인공,Player,Player,,뭐?! 그러면 안되잖아요! 왜 여신님이 함께 사라져야 하는거죠?,What?! She can't do that! Why should the goddess disappear?,什麼？！這樣不行啊！為什麼女神也必須一起消失？,,,,
,85,43,증명의탑,다크나이트,Dark Knight,黑騎士,,시렐라님 때와는 상황이 다르다. 무의미한 희생이 아니야. 지금 여신님이 품은 힘은 엔더 드래곤을 쫓아내기에 충분하다. 혼자만의 희생이 아냐.,Situation is different from Sirella. It is not a meaningless sacrifice. The power of the goddess now is enough to drive out the Ender Dragon. It's not a sacrifice alone.,這次的情況與西瑞拉大人時不同。這不是毫無意義的犧牲。現在女神所擁有的力量足以將終焰龍驅逐出去。這不是她一個人的犧牲。,,,,
,85,44,증명의탑,블리자드,Blizzard,暴風雪,,"우리 힘이 부족한 탓이다. 카데스의 날개 하나, 고작 그거 하나를 상대하는데 여신님이 희생되어야 하다니......","This is because we are weak. Wing of Kades, only one wing of it, and the goddess must be sacrificed for it.",是我們的力量不足。僅僅是對抗卡德斯的翅膀，居然讓女神不得不犧牲……,,,,
,85,45,증명의탑,이그나,Igna,伊格納,,......앞으로 더 강해져야 해. 카데스 정도는 꿈쩍도 하지 않고 상대할 수 있을 정도로.,"I have to be strong, enough to get rid of Kades easily.",……以後必須變得更強，至少能不費吹灰之力對抗卡德斯這種存在。,,,,
,85,46,증명의탑,주인공,Player,Player,,아무렇지도 않게 여신님의 마지막을 받아들이는 수호룡들의 모습은 당황스러울 정도였다. 필요한 희생이라고 그냥 감수한다는건가?,Their acceptance of the goddess's end embarrassed me. Are they just going to make the necessary sacrifices?,那些守護龍毫不在乎地接受女神的最後一刻，讓我感到震驚。他們是說這是必要的犧牲，就這樣默默承受嗎？,,,,
,85,47,증명의탑,고대신룡,God Dragon,古代神龍,변신,힘을 가진 여신의 의지다. 쉽게 말하면 '고작 인간 주제에' 함부로 나서지 마라.,"It is the will of the goddess. To put it simply, the opinion of 'human' doesn't matter.",這是擁有力量的女神的意志。簡單來說，就是‘你這個凡人’不要輕易插手。,,,,
,85,48,증명의탑,주인공,Player,Player,,"하지만 이건 그래도...... 너무하잖아! 이제 겨우 모습을 밝히고, 수호룡과 동생도 만났는데! 아스타로트! 너도 이렇게 끝내고 싶은 건 아니잖아!",But this is still... That's too much! She has barely met guardians and her sister! Astaroth! You don't want to end like this!,但是這樣......也太過分了吧！才剛顯露出真面目，還見到了守護龍和弟弟！亞斯她錄！你也不想就這樣結束吧！,,,,
,85,49,증명의탑,드래곤 슬레이어,Dragon Slayer,屠龍者,변신,가만 있어라. 너 혼자 날뛴다고 해결될게 아니니.,Hold on. You can't disturb it.,安靜點。光是你一個人亂衝是解決不了的。,,,,
,85,50,증명의탑,주인공,Player,Player,,"아무래도 납득할 수 없었던 나는 아스타로트에게 다가갔다. 어떻게든 언니를, 여신님을 말려보라고 말할 작정이었다.","Unconvincing, I approached Astaroth. I was going to tell her to stop her sister.",我實在無法接受，於是走向了亞斯她錄。我打算告訴她，無論如何也要阻止姐姐，阻止女神。,,,,
,,,,퀘스트,퀘스트,퀘스트,,아스타로트를 설득해보자.(증명의 탑에 퀘스트 표시),Try to persuade her.,試著說服亞斯她錄。 (在證明之塔顯示任務標記),,,,
,86,1,증명의탑,엔더 드래곤,Ender dragon,終焰龍,,이건...... 대단하군.,This is... amazing.,這個......真了不起。,,,,
,86,2,증명의탑,쉴라 여신,Sirella,西瑞拉,,살아가는 자들이 빚어낸 탄생의 힘입니다. 이정도면 충분하겠죠?,The power of birth made by living thing. It should be enough for you.,這是活著的存在所創造出的誕生之力。這樣應該就足夠了吧？,,,,
,86,3,증명의탑,엔더 드래곤,Ender dragon,終焰龍,,"충분하다. 정말 놀랐다. '파멸'을 피하는 힘이라니, 단 한번도 맛보지 못했군.","Yes, it is. I really surprised. The power to avoid the doom. I've never seen it before.",足夠了。真的很驚訝。居然是避免‘毀滅’的力量，從來沒有體驗過。,,,,
,86,4,증명의탑,쉴라 여신,Sirella,西瑞拉,,"그건 자랑스럽군요. 태초의 어둠, 그 날개 한조각에게 '놀람'을 선사할 수 있다니 말이죠.","You make me proud. I didn't expect I can surprise a wing of Kades, the beginning of the darkness.",那真是值得驕傲的。居然能夠給初始的黑暗，那片翅膀帶來‘驚訝’。,,,,
,86,5,증명의탑,엔더 드래곤,Ender dragon,終焰龍,,"아스타로트...... 아니, 네 동생이 말했다. 끝은 자신이 선택하는 것이라고.","Astaroth... No, your sister told me so. She will choose the end.",亞斯她錄......不，妳的妹妹說過。結局是由自己選擇的。,,,,
,86,6,증명의탑,쉴라 여신,Sirella,西瑞拉,,"어머, 꽤 건방진 말을 했네요.","Oh, that's pretty cute.",哎呀，真是說了句相當傲慢的話呢。,,,,
,86,7,증명의탑,엔더 드래곤,Ender dragon,終焰龍,,지금의 나로선 부정할 수 없는 말이다. 너희들은 자신의 끝을 선택했구나. 적어도 지금 이 순간은 아닌 것으로.,There is no denying to me now. You've chosen your end. Not at least at this moment...,以現在的我來說，這是無法否認的話。你們選擇了自己的結局。至少現在這一刻，並不是那個時刻。,,,,
,86,8,증명의탑,쉴라 여신,Sirella,西瑞拉,,당신은...... 정말로 카데스의 조각인가요? 당신이 하는 말은 카데스가 하는 말인가요?,Are you... really a piece of Kades? Is that what Kades says?,你......真的是卡德斯的碎片嗎？你說的話是卡德斯會說的話嗎？,,,,
