구분,시나리오 넘버,대사 넘버,배경,캐릭터 한글,캐릭터 영문,캐릭터 번자,표정,대사 한글,대사 영문,대사 번자,연출 종류,사운드,INDEX,CODE
,,,,퀘스트,퀘스트,퀘스트,45,"드래곤 연구소에서 진각성 알아보기.\n(아르하의 입구에 퀘스트 표시)\n(진각성 튜토리얼 진행, 관련 재료 시스템 상 지급)","Understand about Jin-awakening at the Dragon lab.\n(아르하의 입구에 퀘스트 표시)\n(진각성 튜토리얼 진행, 관련 재료 시스템 상 지급)",前往龍研究所了解真覺醒。\n(阿爾哈入口處顯示任務標記)\n(進行真覺醒教程，相關材料系統將發放),,,,
,41,1,드래곤 연구소,지부장,Ellis Finnell,艾莉絲·皮內爾,보통,진각성에는 45레벨에 모든 강화를 끝마친 각성 드래곤이 필요합니다.,"You need Lv.45, awaken dragon with full reinforcement for Jin-awakening.",真覺醒需要一隻達到45級並完成所有強化的覺醒龍。,,,,
,41,2,드래곤 연구소,지부장,Ellis Finnell,艾莉絲·皮內爾,보통,그리고 진각성의 힘을 합쳐줄 두마리의 드래곤이 더 필요합니다.,And you need two more dragons to make Jin-awakening.,此外，還需要另外兩隻龍來融合真覺醒的力量。,,,,
,41,3,드래곤 연구소,지부장,Ellis Finnell,艾莉絲·皮內爾,보통,필요한 아르하의 정수와 페르시온 결정의 수는 등급에 따라 결정됩니다.\n등급이 낮을수록 더 많은 수량이 필요하죠.,"The number of materials required is determined by the grade.\nThe lower the grade, the more materials are needed.",所需的阿爾哈精華和費爾西翁結晶的數量會根據等級決定。\n等級越低，需要的數量就越多。,,,,
,41,4,드래곤 연구소,지부장,Ellis Finnell,艾莉絲·皮內爾,보통,여기까지 알려드렸으니 이제 진각성을 진행해보죠,"Now that I've told you, let's do Jin awakening.",既然已經告訴您這些，現在可以開始進行真覺醒了。,,,,
,41,5,드래곤 연구소,지부장,Ellis Finnell,艾莉絲·皮內爾,보통,렉스톤이 더욱 강해졌습니다.\n이제 아르하로 떠나 고대신룡을 구할 차례입니다.,Rexton is stronger.\nNow it's time to leave Archa and save God dragon.,雷克斯頓變得更強大了。\n現在該前往阿爾哈，拯救古代神龍了。,,,,
,,,,퀘스트,퀘스트,퀘스트,46,아르하로 떠나기\n(아르하의 입구에 퀘스트 표시),Go to Archa.,前往阿爾哈\n(阿爾哈入口處顯示任務標記),,,,