구분,시나리오 넘버,대사 넘버,배경,캐릭터 한글,캐릭터 영문,캐릭터 번자,표정,대사 한글,대사 영문,대사 번자,연출 종류,사운드,INDEX,CODE
,86,9,증명의탑,엔더 드래곤,Ender dragon,終焰龍,,"그렇다고도 할 수 있고, 아니라고도 할 수 있지. 나는 동일하지만 분리된 개체로 존재한다. 너희 신들로서도 알 수 없는 영역이다.","Yes, and no. I am an identical but separate entity. This is an area beyond your goddess.",可以說是，也可以說不是。我以相同但分離的個體存在。這是你們神明也無法理解的領域。,,,,
,86,10,증명의탑,쉴라 여신,Sirella,西瑞拉,,전부터 느끼긴 했어요. 당신은 우리가 알고 있던 '어둠의 신'의 느낌이 아니군요. 그렇다면 당신은 대체......,I've felt it before. You are not the 'god of darkness' we know. Then you are...,我一直有感覺。你並不是我們所認識的‘黑暗之神’的氣息。那么，你到底是……,,,,
,86,11,증명의탑,아스타로트,Astarot,亞斯她錄,화남,기다려!,Wait!,等一下!,,,,
,86,12,증명의탑,주인공,Player,Player,,"내 설득이 통했는지는 모르겠다. 적어도 아스타로트는 자신의 언니, 쉴라 여신님을 부르고 있었다.","I don't know if my persuasion worked. At least Astaroth was calling her sister, the goddess Shilla.",我不知道我的說服是否有效，但至少亞斯她錄在呼喚她的姐姐，希拉女神。,,,,
,86,13,증명의탑,쉴라 여신,Sirella,西瑞拉,,시렐라? 왜 그러니?,Sirella? What's the matter?,西瑞拉？怎麼了？,,,,
,86,14,컷씬7,아스타로트_NO,Astarot_NO,亞斯她錄_NO,X,내가 잘못했어! 언니 말이 맞아! 난...... 난 다시 그렇게 못해. 나도 내가 잘못했다고 알고 있었어! 그냥 겁이 났던 것 뿐이야!,It's my fault! You're right! I... I can't do it again. I knew I was wrong! I was just scared!,我錯了！姐姐說得對！我……我再也不能那樣做了。我知道自己錯了！只是我當時很害怕而已！,,,,
,86,15,컷씬7,쉴라 여신_NO,Sirella_NO,西瑞拉_NO,X,"이런, 또 우네. 울보같으니. 후후.","Oh, come on. What a crybaby! Haha.",唉，又在哭了。真是個愛哭鬼啊。呵呵。,,,,
,86,16,컷씬7,아스타로트_NO,Astarot_NO,亞斯她錄_NO,X,다 내가 잘못한거야! 내가 잘 했다면 우리도 싸워 이겼을거야! 내가 잘못했으니 제발 가지 마!,"I did everything wrong! If I had done well, we would have fought and won! Please don't go!",都是我錯啦！如果我做得對，我們也能打贏的！是我錯了，求求你不要走！,,,,
,86,17,컷씬7,쉴라 여신_NO,Sirella_NO,西瑞拉_NO,X,"아, 이런. 그게 아니야. 그게 아니란다. 내가 떠나는 건 너 때문이 아니야 시렐라. 이건 내가 선택한 내 마지막이야.","Oh, no. That's not it. I'm not leaving because of you, Sirella. This is my last choice.",啊，這不是那樣的。不是因為你，西瑞拉。我離開不是因為你。這是我選擇的，這是我的最後決定。,,,,
,86,18,컷씬7,아스타로트_NO,Astarot_NO,亞斯她錄_NO,X,아니야! 나만 잘했다면 지금이 아니었을거야! 그냥 내가 사라질게! 그러니 제발 가지 마 언니!,"No! If I had done well, it would not be now. I'll just disappear! So please don't go, sister!",不是的！如果我做得對，現在不會是這樣！我會消失的！所以拜託，姐姐不要走！,,,,
,86,19,컷씬7,엔더 드래곤_NO,Ender dragon_NO,終焰龍_NO,X,"넌 잘했다. 넌 네 의지로 '지금까지' 아르하의 파멸을 잘 막았다. 그 결과 지금의 아르하는 파멸로부터 멀리 떨어졌지. 음, 이게 '실패'인가. 난 실패했군.","You did a good job. You have successfully prevented the destruction of Archa by your will. As a result, Archa is far from ruin now. Well, is this a failure? I failed.",你做得很好。你憑自己的意志，‘到現在為止’成功阻止了阿爾哈的毀滅。結果，現在的阿爾哈遠離了毀滅。嗯，這是‘失敗’嗎？我失敗了。,,,,
,86,20,컷씬7,쉴라 여신_NO,Sirella_NO,西瑞拉_NO,X,그렇다네. 들었지? 넌 잘한거야.,That's right. You hear that? You did a good job.,是的。聽到了吧？你做得很好。,,,,
,86,21,컷씬7,아스타로트_NO,Astarot_NO,亞斯她錄_NO,X,저딴놈 말 듣지 마! 언니가 없어지는데 뭘 잘한거야!,Don't listen to him! What did I do for my sister's disappearance?,不要聽那傢伙說的！姐姐都要消失了，怎麼能說做得好！,,,,
,86,22,컷씬7,주인공,Player,Player,,여신님의 빛무리가 점점 거대한 빛무리에 섞여들기 시작했다. 엔더 드래곤의 거대한 몸도 바닥에 쓰러졌다. 아스타로트는 더 크게 울부짖었다.,The goddess's flock of lights began to intermingle into the great mass of light. Ender Dragon's huge body also collapsed on the floor. Astaroth cried out loud.,女神的光圈逐漸融入了那股巨大的光芒中。終焰龍的巨大身軀也倒在了地上。亞斯她錄更加劇烈地哀嚎著。,,,,
,86,23,컷씬7,아스타로트_NO,Astarot_NO,亞斯她錄_NO,X,"아아...... 안돼...... 가지 마, 가지 마 언니!","Ah... no... don't leave me, stay with me, sister!",啊啊......不要......不要走，姐姐，不要走！,,,,
,86,24,컷씬7,쉴라 여신_NO,Sirella_NO,西瑞拉_NO,X,너라면 잘 할 수 있어. 수호룡을 믿으렴. 유타칸의 새로운 동료와도 잘 지내고. 어...... 그리고 해골 그거 진짜 아니지? 얼른 떼렴.,"You can do well. Believe the guardians. Get along well with Utahkhan's new friend. Uh... and the skull isn't real, is it? Get it off.",你一定能做得很好。相信守護龍。也要和尤塔勘的新夥伴們好好相處。嗯......還有那顆骷髏，真的不是吧？快點拿下來。,,,,
,86,25,컷씬7,아스타로트_NO,Astarot_NO,亞斯她錄_NO,X,장난치지 말고 제발...... 아니 장난쳐도 되니 가지마 언니......,"Please don't... no, don't go.",別開玩笑了，拜託......不，算了，就算開玩笑也好，姐姐別走......,,,,
,86,26,컷씬7,주인공,Player,Player,X,하늘의 빛은 점점 사라지고 있었다. 아스타로트...... 아니 시렐라 여신은 더 이상 그쪽을 바라보지 않았다. 그저 고개를 숙이고 흐느낄 뿐.,"The light in the sky was fading away. Astaroth... No, Sirella no longer looked at that. She just cry with her head down.",天上的光芒逐漸消失。亞斯她錄......不，西瑞拉女神再也不看向那邊了。她只是低下頭，輕輕地抽泣著。,,,,
,86,27,컷씬7,솔라_NO,Solar_NO,太陽龍_NO,X,시렐라님. 쉴라 여신님이 떠나십니다. 고개를 드시죠.,"Sirella, the goddess Shilla is leaving. Raise your head.",西瑞拉大人。希拉女神要離開了。抬起頭來吧。,,,,
,86,28,증명의탑,주인공,Player,Player,,솔라가 시렐라 여신을 일으켰다. 시렐라 여신은 하늘을 바라보며 다시 한번 크게 통곡했다. 슬픈 울음소리였다.,"Solar raised the goddess Sirella. The goddess Sirella wept again, looking up at the sky. It was a sad cry.",太陽龍將西瑞拉女神扶起。西瑞拉女神仰望著天空，再次大聲哀嚎並悲傷地哭著。,,,,
,86,29,증명의탑,솔라,Solar,太陽龍,,쉴라 여신님은 자신의 의지로 아르하를 지키셨습니다. 시렐라 여신님도...... 지금까지 나름의 방법으로 아르하를 지켜주셨군요.,"Goddess Shilla protected Archa with her own will. Goddess Sirella, you have protected Archa in your own way.",希拉女神是憑著自己的意志守護著阿爾哈。西瑞拉女神也......以她自己的方式，直到現在一直在守護著阿爾哈。,,,,
,86,30,증명의탑,드래곤 슬레이어,Dragon Slayer,屠龍者,변신,아무렴. 너무 잘지켰지. 유타칸까지 와서 나까지 깨울 정도......,Of course. She kept it so well. She did well enough to come Utahkhan and wake me...,當然了。守得非常好。甚至來到尤塔勘叫醒我......,,,,
,86,31,증명의탑,주인공,Player,Player,,난 도끼눈을 뜨고 드래곤 슬레이어를 쳐다봤다. 드래곤 슬레이어는 픽 웃으며 입을 다물었다.,I stared at Dragon slayer. Dragon slayer smiled and closed his mouth.,我睜大了眼睛，盯著屠龍者。屠龍者咧嘴一笑，然後閉上了嘴巴。,,,,
,86,32,증명의탑,다크나이트,Dark Knight,黑騎士,,쉴라 여신님을 잃은 슬픔과 고통은 저희들도 뼈저리게 느끼고 있습니다. 하지만 일어서야 합니다. 모든 건 이제 시작입니다.,We are also deeply aware of the loss of goddess Shilla. But you have to stand up. Everything is just about to start.,我們也深刻感受到失去希拉女神的悲傷和痛苦。但我們必須克服，一切才剛剛開始。,,,,
,86,33,증명의탑,블리자드,Blizzard,暴風雪,,아직 남은 카데스의 잔재를 몰아내야죠. 예전의 아르하로 돌아갈 길이 멉니다.,Let's get rid of the remnants of the Kades. It's a long way back to Archa of the past.,我們還需要驅逐卡德斯剩餘的殘餘。回到昔日的阿爾哈的路還很遠。,,,,
,86,34,증명의탑,고대신룡,God Dragon,古代神龍,변신,네가 저지른 일을 잊지는 않았다. 하지만 적어도 지금까지처럼 적대할 일은 없겠지.,"I will remember what you did. But I don't have to be hostile to you, at least for a while.",我並沒有忘記你所做的事。但至少今後不會像以前那樣再對立了。,,,,
,86,35,증명의탑,주인공,Player,Player,,앞으로는 뭐...... 동료겠네. 카데스에게 저항하기 위한 동료. 힘을 합쳐야 할 일이 많을거야.,So... you became one of us. The team to against Kades. We have lot of things to do.,以後嘛......我們是夥伴了。為了對抗卡德斯的夥伴。將來會有很多需要合作的事情。,,,,
,86,36,증명의탑,렉스톤,Rexton,雷克斯頓,변신,그러니까 그만 울어. 포폰도 울잖아.,"So, stop crying. You're making Popon cry, too.",所以別再哭了。連波膨也在哭诶。,,,,
,86,37,증명의탑,주인공,Player,Player,,서럽게 울던 시렐라 여신은 자신의 옆에서 같이 울던 포폰을 껴안았다. 포폰도 마주 안고 같이 울었다.,"Sirella, who cried sadly, hugged Popon, who was crying with her. They hugged each other and wept together.",悲傷地哭泣的西瑞拉女神抱住了在她身邊一起哭泣的波彭。波彭也抱著她，一起哭了起來。,,,,
,86,38,증명의탑,주인공,Player,Player,,아무도 그 둘을 말리지 않았다. 눈물이 모두 마를 때까지 둘은 서럽게 울었다. 지켜보던 나까지 눈물이 날뻔 했다.,Nobody stopped the two. They wept sadly until the tears dried up. I almost cried when I was watching.,沒有人阻止那兩個人。他們一直悲傷地哭泣，直到眼淚流盡。就連我看著的也差點流下眼淚。,,,,
,86,39,증명의탑,아스타로트,Astarot,亞斯她錄,보통,......가자.,Let's go...,......走吧。,,,,
,86,40,증명의탑,주인공,Player,Player,,얼마나 시간이 흘렀을까. 긴 울음 끝에 쉴라 여신이 사라진 하늘을 바라본 시렐라 여신은 자리에서 일어나 짧게 한마디를 했다.,"After a long cry, Sirella stood up and said a short word, looking up at the sky where the goddess Shilla had disappeared.",不知過了多久。經過長時間的哭泣，西瑞拉女神看著希拉女神消失的天空，站了起來，簡短地說了一句話。,,,,
,86,41,증명의탑,아스타로트,Astarot,亞斯她錄,보통,시렐라 여신은 카데스에게 잡혀 죽었다. 앞으로 날 아스타로트라고 불러라.,"The goddess Sirella was killed by Kades. From now on, call me Astaroth.",西瑞拉女神被卡德斯抓住並死去。從今以後，叫我亞斯她錄。,,,,
,86,42,증명의탑,주인공,Player,Player,,너 혹시......!,Did you ......!,你是不是......!,,,,
,86,43,증명의탑,아스타로트,Astarot,亞斯她錄,보통,착각하지 마라. 유타칸과의 동맹은 유지할 생각이다. 그리고 난 아르하의 여신으로 활동할 예정이다. 다만...... 더 이상 그 이름은 쓰지 않겠다.,Don't get me wrong. I will form an alliance with Utahkhan. And I'm going to act as the goddess of Archa. But... I won't use that name any more.,別誤會。我會繼續與尤塔勘保持同盟。而且我將繼續作為阿爾哈的女神活動。只是......我不再使用那個名字了。,,,,
,86,44,증명의탑,솔라,Solar,太陽龍,,하지만......,But...,但是......,,,,
,86,45,증명의탑,아스타로트,Astarot,亞斯她錄,보통,결정 사항에 대해서 더이상 토달지 마라. 앞으로 내 말은 여신의 뜻이니 그렇게 따라라.,"Don't oppose my decision. That's how I say it, for it is the will of the goddess.",對於決定的事項不必再多言。從今以後，我的話就是女神的旨意，照著做吧。,,,,
,86,46,증명의탑,주인공,Player,Player,,강력한 카리스마였다. 어린아이같이 울부짖던 모습은 어디서도 찾을 수가 없었다.,It was a charisma. I couldn't find a child crying anywhere.,那是強大的魅力。再也找不到之前像小孩般哀嚎的模樣了。,,,,
,86,47,증명의탑,다크나이트,Dark Knight,黑騎士,,알겠습니다 아스타로트 여신님. 당신의 뜻에 따르겠습니다.,"Yes, goddess Astaroth. I will follow your will.",我明白了，亞斯她錄女神。我會遵從您的旨意。,,,,
,86,48,증명의탑,아스타로트,Astarot,亞斯她錄,보통,앞으로 할 일이 많다. 수호룡들은 앞으로도 솔라를 수장으로 삼아......,There is a lot to be done. All guardian dragons will under the command of Solar and...,未來有很多事情要做。守護龍們將繼續以太陽龍為首領……,,,,
,86,49,증명의탑,주인공,Player,Player,,그 순간 갑자기 엔더 드래곤이 몸을 서서히 일으키기 시작했다. 분명 아까 전에 쓰러지고 꼼짝도 하지 않았을텐데?,"Suddenly, Ender Dragon slowly began to get up. Must have fallen down and not moved?",就在那一刻，終焰龍突然開始慢慢地站起來。明明剛才倒下後一動不動啊，怎麼會……,,,,
,86,50,증명의탑,렉스톤,Rexton,雷克斯頓,변신,"뭐야 갑자기? 너 아까 여신님이랑 같이 떠났잖아! 이제와서 돌아오면, 으아악!",What?! You left with the goddess earlier! Aaaagh!,怎麼回事，怎麼突然？你不是剛才和女神一起離開了嗎！現在回來，啊啊啊！,,,,
,86,51,증명의탑,주인공,Player,Player,,"엔더 드래곤은 손을 뻗어 렉스톤을 덮쳤고, 렉스톤은 간신히 그 공격을 피했다. 뭔가 이상했다. 아까 전의 그 엔더 드래곤이 아니었다.",Ender Dragon reached for Rexton and Rexton avoided the attack. Something was wrong. It was not the same Ender Dragon that he used to be.,終焰龍伸出手來，撲向雷克斯頓，雷克斯頓勉強躲開了那次攻擊。這有點不對勁。這不是剛才的那隻終焰龍。,,,,
,86,52,증명의탑,고대신룡,God Dragon,古代神龍,변신,"아, 그렇군. 엔더 드래곤은 그냥 껍데기다. 그 안에 깃든 파멸의 본질인 카데스의 날개 한장은 돌아갔을거야.","Oh, I see. Ender Dragon is just a shell. One wing of Kades, the essence of destruction in it, must have gone back.",啊，原來如此。終焰龍只是一個外殼。裡面寄宿的毀滅本質——卡德斯的翅膀應該已經回去了。,,,,
,86,53,증명의탑,주인공,Player,Player,,그 말은......?,That means...?,那麼說......?,,,,
,86,54,증명의탑,고대신룡,God Dragon,古代神龍,변신,"이제 저건 그냥 드래곤이다. 파멸의 의지는 잃었겠지만 그 흔적이 남아있는 아주 거대하고 강력한...... 음, 이런.","Now that is just a dragon. The will to ruin may have been lost, but it's a huge and powerful... well...",現在那隻只是龍而已。雖然失去了毀滅的意志，但留下的痕跡依然是一隻巨大而強大的……嗯。,,,,
,86,55,증명의탑,드래곤 슬레이어,Dragon Slayer,屠龍者,변신,난 모른다.,I don't know.,我不知道喔。,,,,
,86,56,증명의탑,주인공,Player,Player,,비겁한 놈 같으니! 드래곤 슬레이어는 순식간에 탑 아래로 사라져버렸다. 하지만 방법이 없었다. 이미 우리는 긴 싸움으로 엉망진창이었으니까.,What a coward! The Dragon slayer ran quickly down the tower. But there was no way. We were already exhausted from a long fight.,真是膽小鬼！屠龍者瞬間消失在塔下。但我們也沒辦法。畢竟我們經過了長時間的戰鬥，已經亂成一團了。,,,,
,86,57,증명의탑,아스타로트,Astarot,亞斯她錄,보통,첫 명령이 정해졌다.,This is my first order.,第一個命令已經確定了。,,,,
,86,58,증명의탑,솔라,Solar,太陽龍,,말씀하시죠.,"Aye, aye ma'am.",請說。,,,,
,86,59,증명의탑,주인공,Player,Player,,"아스타로트는 웃는 듯 우는 듯, 잔뜩 일그러진 표정으로 크게 외쳤다.","Astaroth shouted loudly, with a distorted look on her face.",亞斯她錄帶著像是笑又像是哭、扭曲的表情大聲喊道。,,,,
,86,60,증명의탑,아스타로트,Astarot,亞斯她錄,화남,도망쳐라!,Run!,快跑！,,,,
,,,,퀘스트,퀘스트,퀘스트,,전초기지로 돌아가 지부장님께 보고하자(아르하 월드에 있는 거대한 문에 퀘스트 표시),Go back to outpost and report to branch manager.,回到前哨基地向分部長報告 (在阿爾哈世界的巨大門上顯示任務標記),,,,