,시나리오 넘버,대사 넘버,배경,캐릭터,표정,대사,번역
,25,3,불의 봉인지,주인공,,"내가 할 말이다! 카데스고 뭐고, 이번에야말로 완벽히 소멸시켜주지!",That's my point! This time I'll wipe you out completely!
,25,4,불의 봉인지,G스컬,,건방진 인간 같으니! 어딜 가나 내 일만 방해하는구나!\n고대신룡의 영혼을 빼앗는 김에 다크닉스님의 원수도 갚아주마!,"What a saucy beggar! You are always interrupting my work!\nWhile I am taking away the spirits of God dragon, I will also avenge Dark Nix!"
,25,5,불의 봉인지,주인공,,"어디 덤벼 보라고 한마디 되받아치려 한 그순간, 등 뒤에서 무시무시한 기색이 피어났다.\n또다시 기습인가?!","The moment I tried to hit back with a word, a terrible look came from behind.\nIs it a surprise again?"
,25,6,불의 봉인지,렉스톤,,얘 왜이래?,What's wrong with him?
,25,7,불의 봉인지,주인공,,그곳에는 드래곤 슬레이어가 핏발 선 눈으로 지면을 움켜쥐고 있었다.\n그 손아귀 안에서 단단히 다져진 지면과 바위가 완전히 부서졌다.,"Dragon slayer held the ground with its bloodshot eyes.\nWithin its grip, the ground and rock were completely broken."
,25,8,불의 봉인지,드래곤 슬레이어,,재미있구나 해골바가지. 고대신룡과 다크닉스라고?,That's interesting. Did you say God dragon and Dark Nix?
,25,9,불의 봉인지,G스컬,,"뭐, 뭐냐 네놈은! 날 방해할 작정인가!","What, what are you trying to do?"
,25,10,불의 봉인지,드래곤 슬레이어,,한번 더 말해봐라.,Say it again.
,25,11,불의 봉인지,G스컬,,뭐라고?!,What?
,25,12,불의 봉인지,드래곤 슬레이어,,그 이름을... 한번 더 말해봐라.,Say the name... again.
,,,,퀘스트,30,G스컬을 무찌르자.\n(불의 봉인지에 퀘스트 표시)\n(전투 퀘스트),Defeat G-Skull
,26,1,불의 봉인지,주인공,,"분노한 드래곤 슬레이어의 위력은 무시무시했다.\n순식간에 G스컬을 제압했고, G스컬은 온몸이 조각나서 도망쳤다.","The power of the angry Dragon slayer was terrifying.
\nIn no time, it dominated the G-Skull, and he ran away with his entire body in pieces."
,26,2,불의 봉인지,G스컬,,네놈! 드래곤 슬레이어라고 했나! 절대 가만두지 않겠다!,You! You said Dragon slayer! I'll never forgive you!
,26,3,불의 봉인지,주인공,,"끝까지 입만 살아서 뭐라 고함치는데, 지금 문제는 그게 아니었다.","He was all mouth and no trousers, but that's not the problem now."
,26,4,불의 봉인지,드래곤 슬레이어,,크아아아아아!,Kraaaaaaak!
,26,5,불의 봉인지,솔라,,"진정해라, 적은 모두 물러났다!","Calm down, the enemy is all gone.!"
,26,6,불의 봉인지,주인공,,드래곤 슬레이어가 제정신을 차리지 못하고 있었다.\nG스컬이 고대신룡과 다크닉스의 이름을 언급한 순간부터였다.,Dragon slayer was out of control.\nIt was at the time when the G-Skull mentioned the names of God dragon and Dark Nix.
,26,7,불의 봉인지,드래곤 슬레이어,,증오한다! 죽인다! 고대신룡! 다크닉스! 드래곤!,I hate you! I'll kill you! God dragon! Dark Nix! Dragon!
,26,8,불의 봉인지,렉스톤,,완전히 정신을 잃었어!,It's completely insane.
,26,9,불의 봉인지,주인공,,으윽! 어떻게 말릴 순 없는건가?,Uk! How can we stop it?
,26,10,불의 봉인지,제피로스,,"늦었다, 이렇게 된 이상 쓰러뜨려야 해!","It's too late, we have to knock it down now!"
,,,,퀘스트,31,드래곤 슬레이어를 제압하자.\n(불의 봉인지에 퀘스트 표시)\n(전투 퀘스트) 해보고 안되면 대사로 후려치자,Suppress Dragon Slayer.
,27,1,불의 봉인지,솔라,,큭...... 말도 안되게 강하군.,Kurl............ It is very strong.
,27,2,불의 봉인지,제피로스,,드래곤 슬레이어! 이제 정신이 들었나?,Dragon Slayer! Did you wake up?
,27,3,불의 봉인지,드래곤 슬레이어,,"크윽, 닥쳐라! 큰 소리 내지 마!","Uk, shut up! Don't make a big noise!"
,27,4,불의 봉인지,주인공,,"아직까지도 핏발이 뻗은 눈으로 우리를 노려보는 드래곤 슬레이어.\n이런 반미치광이와 고대신룡을 구하라니, 지부장님의 말을 더 이상 따를 수 없었다.","Dragon Slayer, who is still staring at us with bloodshot eyes.\nSaving God dragon with this lunatic is impossible, I could no longer obey the manager."
,27,5,불의 봉인지,주인공,,이제 더 이상 네녀석과 함께 다닐 순 없을 것 같다.,I don't think I can hang around with you anymore.
,27,6,불의 봉인지,드래곤 슬레이어,,"크하하하! 어디 덤벼봐라, 나도 더 이상 참기 힘들군!\n이런 씹어죽일... 크아악!","Come on! I can't stand it anymore!\nI'll chew your ass ... Craak!"
,27,7,불의 봉인지,주인공,,순간 솔라에게서 강렬한 빛이 뿜어져 나왔다. 앞을 보기가 힘들 정도로 눈부신 빛이었다.\n드래곤 슬레이어는 그 빛을 정면으로 맞고 바닥을 뒹굴고 있었다.,"Solar emits intense light at the moment. It was a dazzling light that could hardly be seen.\nDragon slayer was right against the light, rolling on the floor."
,27,8,불의 봉인지,솔라,,"정화의 빛이다. 심신을 안정시키고 정신을 치유하는 효과가 있지.\n음, 드래곤 슬레이어의 저주에는 오히려 고통이 되는건가.","It is the light of purification. It has a calming effect on the mind.\nWell, is it a pain in the curse of Dragon slayer? "
,27,9,불의 봉인지,드래곤 슬레이어,,이 빌어먹을 드래곤! 다 알고 있으면서! 크아악!,You damned dragon! You knew everything! Craak!
,27,10,불의 봉인지,주인공,,"솔라에게서 다시 한번 강렬한 빛이 뿜어져 나왔고, 드래곤 슬레이어는 쓰러졌다.\n엄청난 위력이었다. 왜 진작 사용하지 않은거지?","Solar did it again, and Dragon slayer collapsed.\nIt was a great. Why didn't you use it before?"
,27,11,불의 봉인지,렉스톤,,왜 진작 안쓰고 지금 쓰는거야?,Why didn't you use it before?
,27,12,불의 봉인지,주인공,,마음이 통한건지 렉스톤이 내 의문과 똑같은 질문을 건냈다.,"Rexton, for my sake, gave him the same question as my question."
,27,13,불의 봉인지,솔라,,"이성을 잃은 이녀석은 안정시킬 심신도, 치유할 정신도 없었다.\n드래곤을 죽이는 괴물일 뿐이었지.",There were no mind to heal.\nIt was just a monster that killed the dragon.
,27,14,불의 봉인지,주인공,,원래 그런 놈이었다. 차라리 지금 끝장을 내는게 나을 정도다.\n이번엔 제피로스가 그런 내 생각을 읽은건지 말을 건냈다.,"That was the way it was. I would rather have finished it now.\nThis time, Zephyros gave me a piece of advice as to whether he had read my thoughts."
,27,15,불의 봉인지,제피로스,,진정해 (주인공). 불안하고 위협스런 '아군'이다만 그 힘은 아직 필요하다.\n게다가 이 녀석도 나름 고생중이겠지.,"Take it easy (주인공). It is an uneasy and menacing "" ally "" but we still need that power.\nAnd he must be struggling with it."
,27,16,불의 봉인지,주인공,,제피로스가 물끄러미 드래곤 슬레이어가 서있던 지면을 바라봤다.\n그곳은 아까 봤던 것처럼 잔뜩 쥐어 터뜨린 바위들로 가득했다.,"Zephyros looked at the ground where Dragon slayer stood.\nIt was full of rocks, as we saw earlier."
,27,17,불의 봉인지,제피로스,,드래곤 슬레이어의 저주가 정확히 어떤 느낌인진 모르겠지만 힘든 점이 있겠지.\n적어도 이 놈은 저항하고있다. 난 그 점을 높이 사고싶군.,"I don't know exactly what the Dragon slayer curse feels like, but it must be hard.\nAt least it is resisting. I would like to put it high."
,27,18,불의 봉인지,주인공,,납득하기 힘들겠지만 일단 조금만 참아보라는 제피로스.\n잠시 뒤 정신을 차린 드래곤 슬레이어는 나를 쏘아봤다. 나는 아무 말도 할 수 없었다.,"It's hard to understand, Zephiros, who says, Be patient.\nDragon Slayer, who came to his senses after a while, retorted at me. I couldn't say anything."
,,,,퀘스트,32,불의 봉인지를 조사하자.\n(불의 봉인지에 퀘스트 표시),Search the land of fire.