,시나리오 넘버,대사 넘버,배경,캐릭터,표정,대사,번역
,35,4,물의 봉인지,솔라,,이블 던! 거기 숨어 있었나!,Evil Dawn! You were hiding there!
,35,5,물의 봉인지,이블 던,,굳이 이 지저분한 싸움판에 끼어들 이유는 없겠지.\n레버넌트! 헬카이저님이 그만 하라고 말씀하셨다.,There is no reason to get involved in this messy battle.\nRevenant! Hell kaiser told you to quit.
,35,6,물의 봉인지,주인공,,이블 던의 말에 레버넌트는 못마땅한 표정으로 공격을 멈췄다.\n그리고 갑자기 등장한 헬카이저의 옆에 자리를 잡았다.,"At the words of Evil Dawn, Revenant stopped the attack with a look of disapproval.\nAnd then he sat next to Hell kaiser."
,35,7,물의 봉인지,헬카이저,,반푼이 수호룡에 빈사의 고대신룡까지 다 모아놨군. 잘했다 이블 던.,"It's a collection of stupid guardians and dying God dragon. Good job, Evil Dawn."
,35,8,물의 봉인지,이블 던,,멍청한 놈들 뿐이라 애 쓸 것도 없었습니다.,It wasn't a big deal because they were just stupid.
,35,9,물의 봉인지,레버넌트,,죽입시다! 다 죽여버립시다! 제가 죽이겠습니다!,Let's kill them! Let's kill them all! I'll kill them!
,35,10,물의 봉인지,헬카이저,,게다가 저 녀석들은... 유타칸에서 왔다는 그놈들인가.\n다크베인이 실수를 했군.,And those are the ones from Yutakan.\nDark Vein has made a mistake.
,35,11,물의 봉인지,주인공,,헬카이저! 다른 수호룡의 행방을 밝혀라!,Hell kaiser! Where is the other guardians!
,35,12,물의 봉인지,헬카이저,,시끄럽다 미천한 녀석. 내 허락 없이 입을 놀리지 마라.\n난 처음 본 녀석이 덤비는 걸 용서할만큼 아량이 깊지 않다.,Be loud and humble ; don't talk without my permission.\nI am not generous enough to forgive someone challenging me.
,35,13,물의 봉인지,주인공,,무시무시한 눈길이었다. 그 알 수 없는 압박에 난 그만 말을 잇지 못했다.,It was a dreadful look. The pressure of that unknown left me speechless.
,35,14,물의 봉인지,드래곤 슬레이어,,"이제 좀 싸워볼만한 놈이 나왔군.\n같잖은 몬스터에, 멍청한 드래곤에 신물이 날 지경이었다.",Now there's someone to fight with.\nI was sick of stupid dragons.
,35,15,물의 봉인지,헬카이저,,네녀석이 드래곤 슬레이어로군. 아스타로트의 유일한 공적.,You must be Dragon slayer. Astarot's only accomplishment.
,35,16,물의 봉인지,드래곤 슬레이어,,실수겠지. 네녀석들의 치명적인 실수.\n고대신룡은 내가 죽인다. 내 복수를 방해하지 마라 버러지들아.,"It would be a mistake. Fatal mistake of yours.
\nI will kill God dragon myself. Don't disturb my vengeance, boys."
,,,,퀘스트,40,헬카이저를 무찌르자\n(물의 봉인지에 퀘스트 표시)\n(이벤트 전투 패배.) hp1이하로 안떨어지면서 공격력 MAX,Defeat Hell kaiser.
